{
  "task_id": "SCI-DATA-FUSION-001",
  "audit_type": "SINGLE_INDEPENDENT_PREEXECUTION_AUDIT",
  "audit_disposition": "SCI_DATA_FUSION_001_SINGLE_INDEPENDENT_PREEXECUTION_AUDIT_PASS",
  "reviewed_head": "e3cb32856aa994e44e1af3aefc6fecff573818f1",
  "reviewed_tree": "b735eba825355e20fb8e4255c1a297b3493dc022",
  "reviewed_freeze_content_manifest_sha256": "a0babb491b5c515e393782311e5be49b51e75ce99710ddb1d8c1c759f145c481",
  "reviewer_identity": "OpenAI GPT-5.6 Pro, acting as implementation-independent reviewer",
  "reviewer_independence_statement": "I did not implement or modify the exact audited freeze and did not execute Phase B. I independently reviewed the exact committed decision surface, immutable artifacts, schemas, authority binding, real-configuration reachability, reducers, reporting and closeout paths, and public CI results. I previously reviewed earlier freezes and specified correction criteria; this enabling pass is limited strictly to the implementation at the exact reviewed head, tree, and freeze-content-manifest identity.",
  "reviewed_authorities": {
    "ewp_base": {"commit": "2bf996596bb7408c2b5e2fc1eb0f7a65e5f5bae2", "tree": "3a3565f8bab605ed706f5ce51bbfed4de039d46b"},
    "accepted_predecessor": {"commit": "186c13000cfb1a402b220bec8fbb89164bac4686"},
    "puckworks": {
      "commit": "2058d0e947ee9eb92c52d64f6165b810f1fb4732",
      "tree": "a6ffb312473b15be43c1571a893b19873ea47c5a",
      "manifest_sha256": "3f073e3c5b2cbbfb9d94a7a2ebc3b06b2d1755b705c101804a3b7946966fb081",
      "available_data_register_sha256": "0c318f43c40361629bb8f25ab4b8ca9f073425ca3ec3a2418bbd8a6cb67a5481",
      "local_corpus_family_index_sha256": "448a1eef0944d0d2b5e0f4ea04b3e5bc8418f315b5a323707f855815f8dcefcd"
    },
    "consumed_artifacts": {"count": 13, "ledger_sha256": "5908b2b48bc94b4d85e21542121b25e128802f3c522584409f4fa7f099836c39"},
    "preexecution_surface": {
      "registered_families": 39, "screened_families": 39, "matched_families": 22, "support_records": 25,
      "porosity_common_candidates": 2, "porosity_independently_eligible_candidates": 2,
      "porosity_required_pairs": 1, "porosity_generated_pairs": 1, "uncertainty_records": 0,
      "blocker_records": 7, "decision_material_blockers": 0
    },
    "superseded_non_enabling_freezes": [
      "54b2164eaf81907a8573d54e89fd8eecbf99293e",
      "1f9b8758c2b2b756eeb29daab28b4dce0cf3525b",
      "c3f7a2b4d93a465adac45a34d43debf35d5e6743"
    ]
  },
  "material_findings": [],
  "review_record_reference": "https://github.com/trbrewer/espresso-whole-pull/pull/136#issuecomment-5512041936",
  "review_date": "2026-09-02"
}
